1,What fabric is the top made of?,1595884714409,yankeelover,first.last@gmail.com,0,1
1,HEY THIS IS A WEIRD QUESTION!!!!!!?,1613888219613,jbilas,first.last@gmail.com,1,4
1,Does this product run big or small?,1608535907083,jbilas,first.last@gmail.com,0,8
153,Nithi laksjd htien alskdj hieor,1606494332700,Hanna_Schmitt83,Tiana_Crooks84@gmail.com,0,12
155,corrypt kjls itjlksdf lsksd kdsllk.,2020-06-03T02:03:23:362Z,Percy_Hahn,Tobin_Sawayn@hotmail.com,0,12
33,                 1608266467489,1613888219613,Juliana72,Vita_Hettinger58@gmail.com,0,17
32,Rerumlkj lkasjd lkasjdas lkajsdasd lkasjds,Wed Sep 09 2020 01:24:55:00,random,Geovanni.Gordon67@gmail.com,0
